{
  "$schema": "https://json-schema.org/draft/2020-12/schema",
  "title": "DPF Public Asset Registry",
  "type": "object",
  "required": ["version", "assets"],
  "properties": {
    "version": { "type": "string" },
    "generated_at": { "type": "string" },
    "governance_skill": { "type": "string" },
    "source_of_truth": { "type": "string" },
    "assets": {
      "type": "array",
      "minItems": 1,
      "items": {
        "type": "object",
        "required": [
          "asset_id",
          "asset_type",
          "name",
          "version",
          "source_path",
          "usage_scope",
          "platforms",
          "status",
          "owner",
          "dependencies",
          "dependents",
          "sync_policy",
          "qa_status",
          "last_updated"
        ],
        "properties": {
          "asset_id": { "type": "string", "pattern": "^[a-z0-9_.-]+$" },
          "asset_type": {
            "enum": [
              "token",
              "base_component",
              "business_component",
              "page_pattern",
              "dialog_pattern",
              "flow_pattern",
              "state_pattern",
              "list_pattern",
              "admin_pattern",
              "icon_asset",
              "copy_asset",
              "illustration_asset",
              "qa_asset",
              "handoff_asset"
            ]
          },
          "name": { "type": "string" },
          "version": { "type": "string" },
          "source_path": { "type": "string" },
          "doc_path": { "type": "string" },
          "usage_scope": { "type": "array", "items": { "type": "string" } },
          "platforms": { "type": "array", "items": { "enum": ["app", "h5", "web", "admin"] } },
          "status": { "enum": ["draft", "approved", "deprecated", "blocked"] },
          "owner": { "type": "string" },
          "dependencies": { "type": "array", "items": { "type": "string" } },
          "dependents": { "type": "array", "items": { "type": "string" } },
          "sync_policy": { "enum": ["auto_sync", "controlled_sync", "manual_migration", "do_not_sync"] },
          "qa_status": { "enum": ["not_checked", "passed", "conditional", "failed"] },
          "last_updated": { "type": "string" },
          "notes": { "type": "string" }
        }
      }
    }
  }
}
