{
  "version": "0.2.0",
  "generated_at": "2026-05-28",
  "governance_skill": "design-public-resource-package-governance v1.1.0-L5",
  "source_of_truth": "workspace-packages with src runtime compatibility surfaces",
  "assets": [
    {
      "asset_id": "token.design-tokens",
      "asset_type": "token",
      "name": "Design Tokens Package",
      "version": "3.1.0",
      "source_path": "packages/design-tokens/registry/tokens.json",
      "doc_path": "packages/design-tokens/registry/tokens.json",
      "usage_scope": [
        "all_pages"
      ],
      "platforms": [
        "app",
        "h5",
        "web"
      ],
      "status": "approved",
      "owner": "design-system-engineering",
      "dependencies": [],
      "dependents": [
        "component.base.component-library",
        "icon.icon-library",
        "pattern.all",
        "component.base.GlobalDialog",
        "registry.overlay-system"
      ],
      "sync_policy": "controlled_sync",
      "qa_status": "passed",
      "last_updated": "2026-05-28"
    },
    {
      "asset_id": "token.color",
      "asset_type": "token",
      "name": "Color Tokens",
      "version": "3.0.0",
      "source_path": "packages/design-tokens/registry/tokens.color.json",
      "doc_path": "packages/design-tokens/registry/tokens.color.json",
      "usage_scope": [
        "all_pages"
      ],
      "platforms": [
        "app",
        "h5",
        "web"
      ],
      "status": "approved",
      "owner": "design-system-engineering",
      "dependencies": [
        "token.design-tokens"
      ],
      "dependents": [],
      "sync_policy": "controlled_sync",
      "qa_status": "passed",
      "last_updated": "2026-05-28"
    },
    {
      "asset_id": "token.semantic-layout",
      "asset_type": "token",
      "name": "Semantic Layout, Spacing, Radius, Typography Roles",
      "version": "1.1.0",
      "source_path": "packages/design-tokens/registry/tokens.json",
      "doc_path": "packages/design-tokens/registry/tokens.json",
      "usage_scope": [
        "all_pages"
      ],
      "platforms": [
        "app",
        "h5",
        "web"
      ],
      "status": "approved",
      "owner": "design-system-engineering",
      "dependencies": [
        "token.design-tokens"
      ],
      "dependents": [],
      "sync_policy": "controlled_sync",
      "qa_status": "passed",
      "last_updated": "2026-05-28"
    },
    {
      "asset_id": "component.base.component-library",
      "asset_type": "base_component",
      "name": "Component Library Manifest",
      "version": "2.2.0",
      "source_path": "packages/component-library/registry/component-manifest.json",
      "doc_path": "packages/component-library/registry/component-manifest.json",
      "usage_scope": [
        "all_pages"
      ],
      "platforms": [
        "app",
        "h5",
        "web"
      ],
      "status": "approved",
      "owner": "design-system-engineering",
      "dependencies": [
        "token.design-tokens",
        "icon.icon-library"
      ],
      "dependents": [
        "business.all",
        "pattern.all",
        "component.base.GlobalDialog",
        "registry.overlay-system"
      ],
      "sync_policy": "controlled_sync",
      "qa_status": "passed",
      "last_updated": "2026-05-28"
    },
    {
      "asset_id": "component.base.Screen",
      "asset_type": "base_component",
      "name": "Screen",
      "version": "1.0.0",
      "source_path": "packages/component-library/registry/component-manifest.json",
      "doc_path": "packages/component-library/registry/component-manifest.json",
      "usage_scope": [
        "app_pages"
      ],
      "platforms": [
        "app",
        "h5",
        "web"
      ],
      "status": "approved",
      "owner": "design-system-engineering",
      "dependencies": [
        "component.base.component-library",
        "token.design-tokens"
      ],
      "dependents": [
        "page.trade",
        "page.portfolio_alias"
      ],
      "sync_policy": "controlled_sync",
      "qa_status": "passed",
      "last_updated": "2026-05-28"
    },
    {
      "asset_id": "component.base.Card",
      "asset_type": "base_component",
      "name": "Card",
      "version": "1.0.2",
      "source_path": "packages/component-library/registry/component-manifest.json",
      "doc_path": "packages/component-library/registry/component-manifest.json",
      "usage_scope": [
        "app_pages"
      ],
      "platforms": [
        "app",
        "h5",
        "web"
      ],
      "status": "approved",
      "owner": "design-system-engineering",
      "dependencies": [
        "component.base.component-library",
        "token.design-tokens"
      ],
      "dependents": [],
      "sync_policy": "controlled_sync",
      "qa_status": "passed",
      "last_updated": "2026-05-28",
      "notes": "Card and card-like panel surfaces use semantic radius.card at 12px and remain borderless; radius.md remains a compatibility alias for non-card surfaces."
    },
    {
      "asset_id": "component.base.ActionButton",
      "asset_type": "base_component",
      "name": "ActionButton",
      "version": "2.0.0",
      "source_path": "packages/component-library/registry/component-manifest.json",
      "doc_path": "packages/component-library/registry/component-manifest.json",
      "usage_scope": [
        "app_pages"
      ],
      "platforms": [
        "app",
        "h5",
        "web"
      ],
      "status": "approved",
      "owner": "design-system-engineering",
      "dependencies": [
        "component.base.component-library",
        "token.design-tokens"
      ],
      "dependents": [],
      "sync_policy": "controlled_sync",
      "qa_status": "passed",
      "last_updated": "2026-05-28"
    },
    {
      "asset_id": "component.base.TextField",
      "asset_type": "base_component",
      "name": "TextField",
      "version": "1.0.0",
      "source_path": "packages/component-library/registry/component-manifest.json",
      "doc_path": "packages/component-library/registry/component-manifest.json",
      "usage_scope": [
        "app_pages"
      ],
      "platforms": [
        "app",
        "h5",
        "web"
      ],
      "status": "approved",
      "owner": "design-system-engineering",
      "dependencies": [
        "component.base.component-library",
        "token.design-tokens"
      ],
      "dependents": [
        "registry.overlay-system"
      ],
      "sync_policy": "controlled_sync",
      "qa_status": "passed",
      "last_updated": "2026-05-28"
    },
    {
      "asset_id": "component.base.BottomSheet",
      "asset_type": "base_component",
      "name": "BottomSheet",
      "version": "1.1.0",
      "source_path": "packages/component-library/registry/component-manifest.json",
      "doc_path": "packages/component-library/registry/component-manifest.json",
      "usage_scope": [
        "app_pages"
      ],
      "platforms": [
        "app",
        "h5",
        "web"
      ],
      "status": "approved",
      "owner": "design-system-engineering",
      "dependencies": [
        "component.base.component-library",
        "token.design-tokens"
      ],
      "dependents": [
        "registry.overlay-system"
      ],
      "sync_policy": "controlled_sync",
      "qa_status": "passed",
      "last_updated": "2026-05-28"
    },
    {
      "asset_id": "component.base.ConfirmActionSheet",
      "asset_type": "base_component",
      "name": "ConfirmActionSheet",
      "version": "1.0.0",
      "source_path": "packages/component-library/registry/component-manifest.json",
      "doc_path": "packages/component-library/registry/component-manifest.json",
      "usage_scope": [
        "app_pages"
      ],
      "platforms": [
        "app",
        "h5",
        "web"
      ],
      "status": "approved",
      "owner": "design-system-engineering",
      "dependencies": [
        "component.base.component-library",
        "token.design-tokens"
      ],
      "dependents": [],
      "sync_policy": "controlled_sync",
      "qa_status": "passed",
      "last_updated": "2026-05-28"
    },
    {
      "asset_id": "component.base.AppIcon",
      "asset_type": "base_component",
      "name": "AppIcon",
      "version": "1.0.0",
      "source_path": "packages/component-library/registry/component-manifest.json",
      "doc_path": "packages/component-library/registry/component-manifest.json",
      "usage_scope": [
        "app_pages"
      ],
      "platforms": [
        "app",
        "h5",
        "web"
      ],
      "status": "approved",
      "owner": "design-system-engineering",
      "dependencies": [
        "component.base.component-library",
        "token.design-tokens"
      ],
      "dependents": [],
      "sync_policy": "controlled_sync",
      "qa_status": "passed",
      "last_updated": "2026-05-28"
    },
    {
      "asset_id": "component.base.IconSurface",
      "asset_type": "base_component",
      "name": "IconSurface",
      "version": "1.0.0",
      "source_path": "packages/component-library/registry/component-manifest.json",
      "doc_path": "packages/component-library/registry/component-manifest.json",
      "usage_scope": [
        "app_pages"
      ],
      "platforms": [
        "app",
        "h5",
        "web"
      ],
      "status": "approved",
      "owner": "design-system-engineering",
      "dependencies": [
        "component.base.component-library",
        "token.design-tokens"
      ],
      "dependents": [],
      "sync_policy": "controlled_sync",
      "qa_status": "passed",
      "last_updated": "2026-05-28"
    },
    {
      "asset_id": "component.base.StatusPill",
      "asset_type": "base_component",
      "name": "StatusPill",
      "version": "1.0.0",
      "source_path": "packages/component-library/registry/component-manifest.json",
      "doc_path": "packages/component-library/registry/component-manifest.json",
      "usage_scope": [
        "app_pages"
      ],
      "platforms": [
        "app",
        "h5",